{
  "$schema": "https://json-schema.org/draft/2020-12/schema",
  "$id": "https://softdata.com.ng/schemas/education/colleges_of_agriculture.schema.json",
  "title": "Nigeria Colleges of Agriculture",
  "description": "The current Nigerian Colleges of Agriculture and Related Disciplines roster published by NBTE.",
  "type": "array",
  "minItems": 31,
  "maxItems": 31,
  "uniqueItems": true,
  "items": {
    "type": "object",
    "additionalProperties": false,
    "required": ["id", "name", "ownership_type", "state_id", "country_code"],
    "properties": {
      "id": {"type": "string", "pattern": "^[a-z0-9]+(?:-[a-z0-9]+)*$"},
      "name": {"type": "string", "minLength": 1},
      "ownership_type": {"type": "string", "enum": ["federal", "state", "private"]},
      "state_id": {"type": "string", "enum": ["abia", "adamawa", "akwa-ibom", "anambra", "bauchi", "bayelsa", "benue", "borno", "cross-river", "delta", "ebonyi", "edo", "ekiti", "enugu", "fct", "gombe", "imo", "jigawa", "kaduna", "kano", "katsina", "kebbi", "kogi", "kwara", "lagos", "nasarawa", "niger", "ogun", "ondo", "osun", "oyo", "plateau", "rivers", "sokoto", "taraba", "yobe", "zamfara"]},
      "country_code": {"const": "NG"}
    }
  }
}
