[
  {"id":"adhama-innovation-enterprise-institute","name":"Adhama Innovation Enterprise Institute","ownership_type":"private","state_id":"kano","country_code":"NG"},
  {"id":"bauchi-oil-and-gas-academy-alkaleri","name":"Bauchi Oil and Gas Academy Alkaleri","ownership_type":"state","state_id":"bauchi","country_code":"NG"},
  {"id":"bonny-vocational-centre","name":"Bonny Vocational Centre","ownership_type":"private","state_id":"rivers","country_code":"NG"},
  {"id":"carlcare-training-school","name":"Carlcare Training School","ownership_type":"private","state_id":"lagos","country_code":"NG"},
  {"id":"carlcare-training-school-ibadan","name":"Carlcare Training School Ibadan","ownership_type":"private","state_id":"oyo","country_code":"NG"},
  {"id":"ekanem-orok-educational-and-learning-foundation","name":"Ekanem Orok Educational and Learning Foundation","ownership_type":"private","state_id":"lagos","country_code":"NG"},
  {"id":"flyingdove-institute-of-technology","name":"Flyingdove Institute of Technology","ownership_type":"private","state_id":"fct","country_code":"NG"},
  {"id":"hasma-innovation-and-skills-acquisition-centre","name":"HASMA Innovation and Skills Acquisition Centre Ltd","ownership_type":"private","state_id":"kano","country_code":"NG"},
  {"id":"highland-college-of-technology","name":"Highland College of Technology","ownership_type":"private","state_id":"oyo","country_code":"NG"},
  {"id":"homik-oil-and-gas-facility-engineering-schools","name":"Homik Oil and Gas Facility Engineering Schools","ownership_type":"private","state_id":"rivers","country_code":"NG"},
  {"id":"imperial-college-of-advanced-studies-limited","name":"Imperial College of Advanced Studies Limited","ownership_type":"private","state_id":"kano","country_code":"NG"},
  {"id":"innovation-and-vocational-enterprise-institute-evt-matan-fada","name":"Innovation and Vocational Enterprise Institute (EVT), Matan Fada, Kano State","ownership_type":"state","state_id":"kano","country_code":"NG"},
  {"id":"katsina-state-institute-of-technology-and-management-ksi-labs-limited","name":"Katsina State Institute of Technology and Management, Katsina KSI Labs Limited","ownership_type":"state","state_id":"katsina","country_code":"NG"},
  {"id":"lufodo-academy-of-performing","name":"Lufodo Academy of Performing","ownership_type":"private","state_id":"lagos","country_code":"NG"},
  {"id":"mario-institute-of-hospitality-management-and-entrepreneurship-education","name":"Mario Institute of Hospitality Management and Entrepreneurship Education","ownership_type":"private","state_id":"enugu","country_code":"NG"},
  {"id":"masterminds-academy-for-tourism-culinary-arts-and-hospitality-ltd","name":"Masterminds Academy for Tourism, Culinary Arts and Hospitality Ltd","ownership_type":"private","state_id":"fct","country_code":"NG"},
  {"id":"minna-institute-of-technology-and-innovation","name":"Minna Institute of Technology and Innovation Minna State","ownership_type":"state","state_id":"niger","country_code":"NG"},
  {"id":"nigeria-korea-friendship-institute","name":"Nigeria Korea Friendship Institute","ownership_type":"private","state_id":"kogi","country_code":"NG"},
  {"id":"pan-learning-centre","name":"PAN Learning Centre","ownership_type":"private","state_id":"kaduna","country_code":"NG"},
  {"id":"saudat-ummulkhair-foundation-school-of-vocational-and-entrepreneurship-education","name":"Saudat & Ummulkhair Foundation: School of Vocational & Entrepreneurship Education","ownership_type":"private","state_id":"kano","country_code":"NG"},
  {"id":"tashiba-institute-of-information-technology-zaria","name":"Tashiba Institute of Information Technology Zaria","ownership_type":"private","state_id":"kaduna","country_code":"NG"},
  {"id":"tewasarace-fashion-school-ltd","name":"Tewasarace Fashion School Ltd","ownership_type":"private","state_id":"lagos","country_code":"NG"},
  {"id":"timeon-kairos-educational-and-vocational-training-institute","name":"Timeon Kairos Educational and Vocational Training Institute","ownership_type":"private","state_id":"lagos","country_code":"NG"},
  {"id":"topearl-institute-of-catering-hospitality-tourism-management","name":"Topearl Institute of Catering, Hospitality/Tourism Management","ownership_type":"private","state_id":"rivers","country_code":"NG"},
  {"id":"utricle-studios-limited","name":"Utricle Studios Limited","ownership_type":"private","state_id":"lagos","country_code":"NG"}
]
